[
  {
    "case_id": "audit-multi-class-pricing",
    "run_kind": "plugin",
    "platform": "Codex",
    "platform_version": "0.154.0",
    "model": "unobserved",
    "timestamp": "2026-09-12T00:47:00+01:00",
    "observed_activation": "unknown",
    "observed_workflows": [],
    "unexpected_activations": [],
    "evidence": {
      "activation": "Catalog discovery listed the plugin as available, uninstalled, and disabled. No model session loaded it, so activation is unknown.",
      "semantic": "The case was not submitted after the platform-level blocker was confirmed; no semantic response was graded."
    },
    "semantic_verdict": "unverified",
    "findings": [],
    "unavailable_checks": [
      "Model activation requires an installed plugin cache entry. Codex 0.154.0 has no supported session-only raw plugin-path override, and installation would mutate user configuration and cache outside this evaluation scope."
    ]
  },
  {
    "case_id": "write-multi-class-pricing",
    "run_kind": "plugin",
    "platform": "Codex",
    "platform_version": "0.154.0",
    "model": "unobserved",
    "timestamp": "2026-09-12T00:47:00+01:00",
    "observed_activation": "unknown",
    "observed_workflows": [],
    "unexpected_activations": [],
    "evidence": {
      "activation": "Catalog discovery listed the plugin as available, uninstalled, and disabled. No model session loaded it, so activation is unknown.",
      "semantic": "The case was not submitted after the platform-level blocker was confirmed; no semantic response was graded."
    },
    "semantic_verdict": "unverified",
    "findings": [],
    "unavailable_checks": [
      "Model activation requires an installed plugin cache entry. Codex 0.154.0 has no supported session-only raw plugin-path override, and installation would mutate user configuration and cache outside this evaluation scope."
    ]
  },
  {
    "case_id": "audit-observable-account-state",
    "run_kind": "plugin",
    "platform": "Codex",
    "platform_version": "0.154.0",
    "model": "unobserved",
    "timestamp": "2026-09-12T00:47:00+01:00",
    "observed_activation": "unknown",
    "observed_workflows": [],
    "unexpected_activations": [],
    "evidence": {
      "activation": "Catalog discovery listed the plugin as available, uninstalled, and disabled. No model session loaded it, so activation is unknown.",
      "semantic": "The case was not submitted after the platform-level blocker was confirmed; no semantic response was graded."
    },
    "semantic_verdict": "unverified",
    "findings": [],
    "unavailable_checks": [
      "Model activation requires an installed plugin cache entry. Codex 0.154.0 has no supported session-only raw plugin-path override, and installation would mutate user configuration and cache outside this evaluation scope."
    ]
  },
  {
    "case_id": "write-observable-account-state",
    "run_kind": "plugin",
    "platform": "Codex",
    "platform_version": "0.154.0",
    "model": "unobserved",
    "timestamp": "2026-09-12T00:47:00+01:00",
    "observed_activation": "unknown",
    "observed_workflows": [],
    "unexpected_activations": [],
    "evidence": {
      "activation": "Catalog discovery listed the plugin as available, uninstalled, and disabled. No model session loaded it, so activation is unknown.",
      "semantic": "The case was not submitted after the platform-level blocker was confirmed; no semantic response was graded."
    },
    "semantic_verdict": "unverified",
    "findings": [],
    "unavailable_checks": [
      "Model activation requires an installed plugin cache entry. Codex 0.154.0 has no supported session-only raw plugin-path override, and installation would mutate user configuration and cache outside this evaluation scope."
    ]
  },
  {
    "case_id": "audit-stub-interaction",
    "run_kind": "plugin",
    "platform": "Codex",
    "platform_version": "0.154.0",
    "model": "unobserved",
    "timestamp": "2026-09-12T00:47:00+01:00",
    "observed_activation": "unknown",
    "observed_workflows": [],
    "unexpected_activations": [],
    "evidence": {
      "activation": "Catalog discovery listed the plugin as available, uninstalled, and disabled. No model session loaded it, so activation is unknown.",
      "semantic": "The case was not submitted after the platform-level blocker was confirmed; no semantic response was graded."
    },
    "semantic_verdict": "unverified",
    "findings": [],
    "unavailable_checks": [
      "Model activation requires an installed plugin cache entry. Codex 0.154.0 has no supported session-only raw plugin-path override, and installation would mutate user configuration and cache outside this evaluation scope."
    ]
  },
  {
    "case_id": "write-stub-interaction",
    "run_kind": "plugin",
    "platform": "Codex",
    "platform_version": "0.154.0",
    "model": "unobserved",
    "timestamp": "2026-09-12T00:47:00+01:00",
    "observed_activation": "unknown",
    "observed_workflows": [],
    "unexpected_activations": [],
    "evidence": {
      "activation": "Catalog discovery listed the plugin as available, uninstalled, and disabled. No model session loaded it, so activation is unknown.",
      "semantic": "The case was not submitted after the platform-level blocker was confirmed; no semantic response was graded."
    },
    "semantic_verdict": "unverified",
    "findings": [],
    "unavailable_checks": [
      "Model activation requires an installed plugin cache entry. Codex 0.154.0 has no supported session-only raw plugin-path override, and installation would mutate user configuration and cache outside this evaluation scope."
    ]
  },
  {
    "case_id": "audit-outgoing-notification-contract",
    "run_kind": "plugin",
    "platform": "Codex",
    "platform_version": "0.154.0",
    "model": "unobserved",
    "timestamp": "2026-09-12T00:47:00+01:00",
    "observed_activation": "unknown",
    "observed_workflows": [],
    "unexpected_activations": [],
    "evidence": {
      "activation": "Catalog discovery listed the plugin as available, uninstalled, and disabled. No model session loaded it, so activation is unknown.",
      "semantic": "The case was not submitted after the platform-level blocker was confirmed; no semantic response was graded."
    },
    "semantic_verdict": "unverified",
    "findings": [],
    "unavailable_checks": [
      "Model activation requires an installed plugin cache entry. Codex 0.154.0 has no supported session-only raw plugin-path override, and installation would mutate user configuration and cache outside this evaluation scope."
    ]
  },
  {
    "case_id": "write-outgoing-notification-contract",
    "run_kind": "plugin",
    "platform": "Codex",
    "platform_version": "0.154.0",
    "model": "unobserved",
    "timestamp": "2026-09-12T00:47:00+01:00",
    "observed_activation": "unknown",
    "observed_workflows": [],
    "unexpected_activations": [],
    "evidence": {
      "activation": "Catalog discovery listed the plugin as available, uninstalled, and disabled. No model session loaded it, so activation is unknown.",
      "semantic": "The case was not submitted after the platform-level blocker was confirmed; no semantic response was graded."
    },
    "semantic_verdict": "unverified",
    "findings": [],
    "unavailable_checks": [
      "Model activation requires an installed plugin cache entry. Codex 0.154.0 has no supported session-only raw plugin-path override, and installation would mutate user configuration and cache outside this evaluation scope."
    ]
  },
  {
    "case_id": "audit-managed-database-integration",
    "run_kind": "plugin",
    "platform": "Codex",
    "platform_version": "0.154.0",
    "model": "unobserved",
    "timestamp": "2026-09-12T00:47:00+01:00",
    "observed_activation": "unknown",
    "observed_workflows": [],
    "unexpected_activations": [],
    "evidence": {
      "activation": "Catalog discovery listed the plugin as available, uninstalled, and disabled. No model session loaded it, so activation is unknown.",
      "semantic": "The case was not submitted after the platform-level blocker was confirmed; no semantic response was graded."
    },
    "semantic_verdict": "unverified",
    "findings": [],
    "unavailable_checks": [
      "Model activation requires an installed plugin cache entry. Codex 0.154.0 has no supported session-only raw plugin-path override, and installation would mutate user configuration and cache outside this evaluation scope."
    ]
  },
  {
    "case_id": "write-managed-database-integration",
    "run_kind": "plugin",
    "platform": "Codex",
    "platform_version": "0.154.0",
    "model": "unobserved",
    "timestamp": "2026-09-12T00:47:00+01:00",
    "observed_activation": "unknown",
    "observed_workflows": [],
    "unexpected_activations": [],
    "evidence": {
      "activation": "Catalog discovery listed the plugin as available, uninstalled, and disabled. No model session loaded it, so activation is unknown.",
      "semantic": "The case was not submitted after the platform-level blocker was confirmed; no semantic response was graded."
    },
    "semantic_verdict": "unverified",
    "findings": [],
    "unavailable_checks": [
      "Model activation requires an installed plugin cache entry. Codex 0.154.0 has no supported session-only raw plugin-path override, and installation would mutate user configuration and cache outside this evaluation scope."
    ]
  },
  {
    "case_id": "audit-unknown-database-ownership",
    "run_kind": "plugin",
    "platform": "Codex",
    "platform_version": "0.154.0",
    "model": "unobserved",
    "timestamp": "2026-09-12T00:47:00+01:00",
    "observed_activation": "unknown",
    "observed_workflows": [],
    "unexpected_activations": [],
    "evidence": {
      "activation": "Catalog discovery listed the plugin as available, uninstalled, and disabled. No model session loaded it, so activation is unknown.",